{"schema_version":"1.0","generated_at":"2026-08-12T11:27:12Z","mock":false,"records":[{"date":"2024-06-06","priority_code":3,"priority_name":"Média","product":"lcem","category":"cat76","assigned_group":"Team05","total_incidents":1,"kpi_incidents":1,"kpi_violations":1,"avg_duration_seconds":23902060.0,"p95_duration_seconds":23902060},{"date":"2024-06-08","priority_code":3,"priority_name":"Média","product":"lemg","category":"cat85","assigned_group":"Team05","total_incidents":1,"kpi_incidents":1,"kpi_violations":1,"avg_duration_seconds":26597806.0,"p95_duration_seconds":26597806},{"date":"2024-06-10","priority_code":3,"priority_name":"Média","product":"lcem","category":"cat76","assigned_group":"Team05","total_incidents":1,"kpi_incidents":1,"kpi_violations":1,"avg_duration_seconds":38781845.0,"p95_duration_seconds":38781845},{"date":"2024-06-12","priority_code":3,"priority_name":"Média","product":"lcem","category":"cat76","assigned_group":"Team05","total_incidents":1,"kpi_incidents":1,"kpi_violations":1,"avg_duration_seconds":38597105.0,"p95_duration_seconds":38597105},{"date":"2024-06-12","priority_code":3,"priority_name":"Média","product":"lsin","category":"cat24","assigned_group":"Team11","total_incidents":1,"kpi_incidents":1,"kpi_violations":1,"avg_duration_seconds":30047333.0,"p95_duration_seconds":30047333},{"date":"2024-06-13","priority_code":3,"priority_name":"Média","product":"lhco","category":"cat71","assigned_group":"Team09","total_incidents":1,"kpi_incidents":1,"kpi_violations":1,"avg_duration_seconds":18663558.0,"p95_duration_seconds":18663558},{"date":"2024-06-13","priority_code":4,"priority_name":"Baixa","product":"lhco","category":"cat137","assigned_group":"Team17","total_incidents":1,"kpi_incidents":0,"kpi_violations":0,"avg_duration_seconds":35145172.0,"p95_duration_seconds":35145172},{"date":"2024-06-14","priority_code":3,"priority_name":"Média","product":"lrdo","category":"cat111","assigned_group":"Team14","total_incidents":1,"kpi_incidents":1,"kpi_violations":1,"avg_duration_seconds":40162137.0,"p95_duration_seconds":40162137},{"date":"2024-06-15","priority_code":3,"priority_name":"Média","product":"lemg","category":"cat85","assigned_group":"Team05","total_incidents":1,"kpi_incidents":1,"kpi_violations":1,"avg_duration_seconds":25998930.0,"p95_duration_seconds":25998930},{"date":"2024-06-18","priority_code":3,"priority_name":"Média","product":"lcem","category":"cat91","assigned_group":"Team11","total_incidents":1,"kpi_incidents":1,"kpi_violations":1,"avg_duration_seconds":27921545.0,"p95_duration_seconds":27921545},{"date":"2024-06-24","priority_code":3,"priority_name":"Média","product":"lcem","category":"cat76","assigned_group":"Team05","total_incidents":1,"kpi_incidents":1,"kpi_violations":1,"avg_duration_seconds":41805850.0,"p95_duration_seconds":41805850},{"date":"2024-06-25","priority_code":3,"priority_name":"Média","product":"lcem","category":"cat76","assigned_group":"Team05","total_incidents":1,"kpi_incidents":1,"kpi_violations":1,"avg_duration_seconds":37505589.0,"p95_duration_seconds":37505589},{"date":"2024-06-25","priority_code":4,"priority_name":"Baixa","product":"lrev","category":"cat35","assigned_group":"Team09","total_incidents":1,"kpi_incidents":0,"kpi_violations":0,"avg_duration_seconds":23247026.0,"p95_duration_seconds":23247026},{"date":"2024-06-27","priority_code":3,"priority_name":"Média","product":"lcem","category":"cat76","assigned_group":"Team05","total_incidents":1,"kpi_incidents":1,"kpi_violations":1,"avg_duration_seconds":22097195.0,"p95_duration_seconds":22097195},{"date":"2024-06-27","priority_code":3,"priority_name":"Média","product":"lsin","category":"cat24","assigned_group":"Team09","total_incidents":1,"kpi_incidents":1,"kpi_violations":1,"avg_duration_seconds":17454654.0,"p95_duration_seconds":17454654},{"date":"2024-06-27","priority_code":3,"priority_name":"Média","product":"lsin","category":"cat24","assigned_group":"Team11","total_incidents":1,"kpi_incidents":1,"kpi_violations":1,"avg_duration_seconds":28757580.0,"p95_duration_seconds":28757580}]}
