{"schema_version":"1.0","generated_at":"2026-08-12T11:27:12Z","mock":false,"records":[{"date":"2023-04-03","priority_code":3,"priority_name":"Média","product":"lcem","category":"cat76","assigned_group":"Team05","total_incidents":1,"kpi_incidents":1,"kpi_violations":1,"avg_duration_seconds":61075682.0,"p95_duration_seconds":61075682},{"date":"2023-04-10","priority_code":3,"priority_name":"Média","product":"lcem","category":"cat76","assigned_group":"Team06","total_incidents":1,"kpi_incidents":1,"kpi_violations":1,"avg_duration_seconds":60480304.0,"p95_duration_seconds":60480304},{"date":"2023-04-19","priority_code":3,"priority_name":"Média","product":"lcem","category":"cat76","assigned_group":"Team06","total_incidents":1,"kpi_incidents":1,"kpi_violations":1,"avg_duration_seconds":59693060.0,"p95_duration_seconds":59693060},{"date":"2023-04-20","priority_code":3,"priority_name":"Média","product":"lcsp","category":"cat85","assigned_group":"Team11","total_incidents":1,"kpi_incidents":1,"kpi_violations":1,"avg_duration_seconds":61924345.0,"p95_duration_seconds":61924345},{"date":"2023-04-26","priority_code":3,"priority_name":"Média","product":"lcem","category":"cat76","assigned_group":"Team06","total_incidents":1,"kpi_incidents":1,"kpi_violations":1,"avg_duration_seconds":59079276.0,"p95_duration_seconds":59079276},{"date":"2023-04-27","priority_code":3,"priority_name":"Média","product":"lcem","category":"cat76","assigned_group":"Team05","total_incidents":1,"kpi_incidents":1,"kpi_violations":1,"avg_duration_seconds":74195785.0,"p95_duration_seconds":74195785}]}
