{"schema_version":"1.0","generated_at":"2026-08-12T11:27:12Z","mock":false,"records":[{"date":"2024-04-02","priority_code":3,"priority_name":"Média","product":"lcem","category":"cat76","assigned_group":"Team06","total_incidents":2,"kpi_incidents":2,"kpi_violations":2,"avg_duration_seconds":38599525.0,"p95_duration_seconds":44757460},{"date":"2024-04-03","priority_code":3,"priority_name":"Média","product":"lsin","category":"cat29","assigned_group":"Team09","total_incidents":1,"kpi_incidents":1,"kpi_violations":1,"avg_duration_seconds":24789561.0,"p95_duration_seconds":24789561},{"date":"2024-04-06","priority_code":3,"priority_name":"Média","product":"lcsp","category":"cat85","assigned_group":"Team14","total_incidents":1,"kpi_incidents":1,"kpi_violations":1,"avg_duration_seconds":31703654.0,"p95_duration_seconds":31703654},{"date":"2024-04-06","priority_code":4,"priority_name":"Baixa","product":"lsg2","category":"cat71","assigned_group":"Team09","total_incidents":1,"kpi_incidents":0,"kpi_violations":0,"avg_duration_seconds":31940238.0,"p95_duration_seconds":31940238},{"date":"2024-04-10","priority_code":3,"priority_name":"Média","product":"lsin","category":"cat24","assigned_group":"Team09","total_incidents":1,"kpi_incidents":1,"kpi_violations":1,"avg_duration_seconds":24198610.0,"p95_duration_seconds":24198610},{"date":"2024-04-10","priority_code":4,"priority_name":"Baixa","product":"lcem","category":"cat76","assigned_group":"Team05","total_incidents":4,"kpi_incidents":0,"kpi_violations":0,"avg_duration_seconds":22667347.75,"p95_duration_seconds":22678386},{"date":"2024-04-13","priority_code":3,"priority_name":"Média","product":"lcem","category":"cat76","assigned_group":"Team05","total_incidents":1,"kpi_incidents":1,"kpi_violations":1,"avg_duration_seconds":43799081.0,"p95_duration_seconds":43799081},{"date":"2024-04-15","priority_code":3,"priority_name":"Média","product":"lcem","category":"cat76","assigned_group":"Team05","total_incidents":1,"kpi_incidents":1,"kpi_violations":1,"avg_duration_seconds":43631375.0,"p95_duration_seconds":43631375},{"date":"2024-04-15","priority_code":3,"priority_name":"Média","product":"lcem","category":"cat76","assigned_group":"Team06","total_incidents":1,"kpi_incidents":1,"kpi_violations":1,"avg_duration_seconds":43654119.0,"p95_duration_seconds":43654119},{"date":"2024-04-15","priority_code":3,"priority_name":"Média","product":"lcem","category":"cat91","assigned_group":"Team05","total_incidents":1,"kpi_incidents":1,"kpi_violations":0,"avg_duration_seconds":4521.0,"p95_duration_seconds":4521},{"date":"2024-04-15","priority_code":3,"priority_name":"Média","product":"lhco","category":"cat71","assigned_group":"Team09","total_incidents":1,"kpi_incidents":1,"kpi_violations":1,"avg_duration_seconds":23748480.0,"p95_duration_seconds":23748480},{"date":"2024-04-16","priority_code":3,"priority_name":"Média","product":"lemg","category":"cat85","assigned_group":"Team05","total_incidents":1,"kpi_incidents":1,"kpi_violations":1,"avg_duration_seconds":26603049.0,"p95_duration_seconds":26603049},{"date":"2024-04-18","priority_code":3,"priority_name":"Média","product":"lcho","category":"cat18","assigned_group":"Team11","total_incidents":1,"kpi_incidents":1,"kpi_violations":1,"avg_duration_seconds":24187626.0,"p95_duration_seconds":24187626},{"date":"2024-04-20","priority_code":3,"priority_name":"Média","product":"lcem","category":"cat76","assigned_group":"Team06","total_incidents":1,"kpi_incidents":1,"kpi_violations":1,"avg_duration_seconds":30925718.0,"p95_duration_seconds":30925718},{"date":"2024-04-20","priority_code":3,"priority_name":"Média","product":"lemg","category":"cat85","assigned_group":"Team05","total_incidents":1,"kpi_incidents":1,"kpi_violations":1,"avg_duration_seconds":30828191.0,"p95_duration_seconds":30828191},{"date":"2024-04-23","priority_code":3,"priority_name":"Média","product":"lemg","category":"cat85","assigned_group":"Team05","total_incidents":1,"kpi_incidents":1,"kpi_violations":1,"avg_duration_seconds":30559160.0,"p95_duration_seconds":30559160},{"date":"2024-04-23","priority_code":3,"priority_name":"Média","product":"lhco","category":"cat71","assigned_group":"Team09","total_incidents":1,"kpi_incidents":1,"kpi_violations":1,"avg_duration_seconds":23052778.0,"p95_duration_seconds":23052778},{"date":"2024-04-24","priority_code":3,"priority_name":"Média","product":"lsin","category":"cat24","assigned_group":"Team09","total_incidents":1,"kpi_incidents":1,"kpi_violations":1,"avg_duration_seconds":23004660.0,"p95_duration_seconds":23004660},{"date":"2024-04-25","priority_code":3,"priority_name":"Média","product":"lcem","category":"cat76","assigned_group":"Team06","total_incidents":1,"kpi_incidents":1,"kpi_violations":1,"avg_duration_seconds":42779572.0,"p95_duration_seconds":42779572},{"date":"2024-04-25","priority_code":4,"priority_name":"Baixa","product":"lcem","category":"cat76","assigned_group":"Team05","total_incidents":2,"kpi_incidents":0,"kpi_violations":0,"avg_duration_seconds":21374631.0,"p95_duration_seconds":21374632},{"date":"2024-04-27","priority_code":3,"priority_name":"Média","product":"lsin","category":"cat77","assigned_group":"Team17","total_incidents":1,"kpi_incidents":1,"kpi_violations":1,"avg_duration_seconds":21645238.0,"p95_duration_seconds":21645238}]}
