{"schema_version":"1.0","generated_at":"2026-08-12T11:27:12Z","mock":false,"records":[{"date":"2023-09-05","priority_code":3,"priority_name":"Média","product":"lcem","category":"cat76","assigned_group":"Team06","total_incidents":1,"kpi_incidents":1,"kpi_violations":1,"avg_duration_seconds":47666600.0,"p95_duration_seconds":47666600},{"date":"2023-09-05","priority_code":3,"priority_name":"Média","product":"lrev","category":"cat97","assigned_group":"Team17","total_incidents":1,"kpi_incidents":1,"kpi_violations":1,"avg_duration_seconds":41966462.0,"p95_duration_seconds":41966462},{"date":"2023-09-11","priority_code":4,"priority_name":"Baixa","product":"lsin","category":"cat15","assigned_group":"Team17","total_incidents":1,"kpi_incidents":0,"kpi_violations":0,"avg_duration_seconds":70152459.0,"p95_duration_seconds":70152459},{"date":"2023-09-14","priority_code":3,"priority_name":"Média","product":"lcem","category":"cat76","assigned_group":"Team06","total_incidents":1,"kpi_incidents":1,"kpi_violations":1,"avg_duration_seconds":46915861.0,"p95_duration_seconds":46915861},{"date":"2023-09-14","priority_code":3,"priority_name":"Média","product":"lemg","category":"cat85","assigned_group":"Team05","total_incidents":1,"kpi_incidents":1,"kpi_violations":1,"avg_duration_seconds":49758769.0,"p95_duration_seconds":49758769},{"date":"2023-09-18","priority_code":3,"priority_name":"Média","product":"lcem","category":"cat76","assigned_group":"Team06","total_incidents":1,"kpi_incidents":1,"kpi_violations":1,"avg_duration_seconds":46572004.0,"p95_duration_seconds":46572004},{"date":"2023-09-24","priority_code":3,"priority_name":"Média","product":"lcem","category":"cat76","assigned_group":"Team05","total_incidents":1,"kpi_incidents":1,"kpi_violations":1,"avg_duration_seconds":65497590.0,"p95_duration_seconds":65497590},{"date":"2023-09-26","priority_code":3,"priority_name":"Média","product":"lemg","category":"cat85","assigned_group":"Team05","total_incidents":1,"kpi_incidents":1,"kpi_violations":1,"avg_duration_seconds":48712180.0,"p95_duration_seconds":48712180},{"date":"2023-09-26","priority_code":3,"priority_name":"Média","product":"lsin","category":"cat29","assigned_group":"Team09","total_incidents":1,"kpi_incidents":1,"kpi_violations":1,"avg_duration_seconds":41213830.0,"p95_duration_seconds":41213830},{"date":"2023-09-27","priority_code":3,"priority_name":"Média","product":"lemg","category":"cat42","assigned_group":"Team05","total_incidents":1,"kpi_incidents":1,"kpi_violations":1,"avg_duration_seconds":48623978.0,"p95_duration_seconds":48623978},{"date":"2023-09-28","priority_code":3,"priority_name":"Média","product":"lcem","category":"cat76","assigned_group":"Team05","total_incidents":1,"kpi_incidents":1,"kpi_violations":1,"avg_duration_seconds":49861350.0,"p95_duration_seconds":49861350},{"date":"2023-09-28","priority_code":3,"priority_name":"Média","product":"lrel","category":"cat85","assigned_group":"Team09","total_incidents":1,"kpi_incidents":1,"kpi_violations":1,"avg_duration_seconds":41054593.0,"p95_duration_seconds":41054593},{"date":"2023-09-29","priority_code":3,"priority_name":"Média","product":"lcem","category":"cat76","assigned_group":"Team05","total_incidents":1,"kpi_incidents":1,"kpi_violations":1,"avg_duration_seconds":47161585.0,"p95_duration_seconds":47161585},{"date":"2023-09-29","priority_code":3,"priority_name":"Média","product":"lcem","category":"cat76","assigned_group":"Team06","total_incidents":1,"kpi_incidents":1,"kpi_violations":1,"avg_duration_seconds":45597593.0,"p95_duration_seconds":45597593}]}
