{"schema_version":"1.0","generated_at":"2026-08-12T11:27:12Z","mock":false,"records":[{"date":"2024-07-02","priority_code":3,"priority_name":"Média","product":"lsin","category":"cat24","assigned_group":"Team09","total_incidents":1,"kpi_incidents":1,"kpi_violations":1,"avg_duration_seconds":17036060.0,"p95_duration_seconds":17036060},{"date":"2024-07-04","priority_code":3,"priority_name":"Média","product":"lsin","category":"cat24","assigned_group":"Team09","total_incidents":1,"kpi_incidents":1,"kpi_violations":1,"avg_duration_seconds":16863113.0,"p95_duration_seconds":16863113},{"date":"2024-07-05","priority_code":3,"priority_name":"Média","product":"lcem","category":"cat76","assigned_group":"Team05","total_incidents":1,"kpi_incidents":1,"kpi_violations":1,"avg_duration_seconds":21406037.0,"p95_duration_seconds":21406037},{"date":"2024-07-05","priority_code":3,"priority_name":"Média","product":"lsin","category":"cat24","assigned_group":"Team09","total_incidents":1,"kpi_incidents":1,"kpi_violations":1,"avg_duration_seconds":16767572.0,"p95_duration_seconds":16767572},{"date":"2024-07-05","priority_code":4,"priority_name":"Baixa","product":"lcem","category":"cat76","assigned_group":"Team05","total_incidents":1,"kpi_incidents":0,"kpi_violations":0,"avg_duration_seconds":15225336.0,"p95_duration_seconds":15225336},{"date":"2024-07-06","priority_code":3,"priority_name":"Média","product":"lcem","category":"cat76","assigned_group":"Team05","total_incidents":1,"kpi_incidents":1,"kpi_violations":1,"avg_duration_seconds":36529491.0,"p95_duration_seconds":36529491},{"date":"2024-07-06","priority_code":4,"priority_name":"Baixa","product":"lrel","category":"cat85","assigned_group":"Team09","total_incidents":1,"kpi_incidents":0,"kpi_violations":0,"avg_duration_seconds":16651339.0,"p95_duration_seconds":16651339},{"date":"2024-07-09","priority_code":3,"priority_name":"Média","product":"lsin","category":"cat24","assigned_group":"Team09","total_incidents":1,"kpi_incidents":1,"kpi_violations":1,"avg_duration_seconds":16423651.0,"p95_duration_seconds":16423651},{"date":"2024-07-10","priority_code":3,"priority_name":"Média","product":"lsin","category":"cat24","assigned_group":"Team09","total_incidents":1,"kpi_incidents":1,"kpi_violations":1,"avg_duration_seconds":16326381.0,"p95_duration_seconds":16326381},{"date":"2024-07-10","priority_code":3,"priority_name":"Média","product":"lsin","category":"cat31","assigned_group":"Team11","total_incidents":1,"kpi_incidents":1,"kpi_violations":1,"avg_duration_seconds":23397963.0,"p95_duration_seconds":23397963},{"date":"2024-07-11","priority_code":3,"priority_name":"Média","product":"lsin","category":"cat24","assigned_group":"Team09","total_incidents":1,"kpi_incidents":1,"kpi_violations":1,"avg_duration_seconds":16246469.0,"p95_duration_seconds":16246469},{"date":"2024-07-11","priority_code":4,"priority_name":"Baixa","product":"lsin","category":"cat77","assigned_group":"Team09","total_incidents":1,"kpi_incidents":0,"kpi_violations":0,"avg_duration_seconds":21910256.0,"p95_duration_seconds":21910256},{"date":"2024-07-12","priority_code":3,"priority_name":"Média","product":"lcem","category":"cat76","assigned_group":"Team05","total_incidents":1,"kpi_incidents":1,"kpi_violations":1,"avg_duration_seconds":20821413.0,"p95_duration_seconds":20821413},{"date":"2024-07-14","priority_code":4,"priority_name":"Baixa","product":"lcem","category":"cat76","assigned_group":"Team05","total_incidents":1,"kpi_incidents":0,"kpi_violations":0,"avg_duration_seconds":40099476.0,"p95_duration_seconds":40099476},{"date":"2024-07-15","priority_code":3,"priority_name":"Média","product":"lcem","category":"cat76","assigned_group":"Team05","total_incidents":1,"kpi_incidents":1,"kpi_violations":1,"avg_duration_seconds":40036938.0,"p95_duration_seconds":40036938},{"date":"2024-07-15","priority_code":3,"priority_name":"Média","product":"lsin","category":"cat24","assigned_group":"Team09","total_incidents":3,"kpi_incidents":3,"kpi_violations":3,"avg_duration_seconds":15910928.67,"p95_duration_seconds":15917816},{"date":"2024-07-17","priority_code":3,"priority_name":"Média","product":"lsin","category":"cat24","assigned_group":"Team09","total_incidents":1,"kpi_incidents":1,"kpi_violations":1,"avg_duration_seconds":15745445.0,"p95_duration_seconds":15745445},{"date":"2024-07-17","priority_code":4,"priority_name":"Baixa","product":"lrev","category":"cat97","assigned_group":"Team05","total_incidents":1,"kpi_incidents":0,"kpi_violations":0,"avg_duration_seconds":14802532.0,"p95_duration_seconds":14802532},{"date":"2024-07-17","priority_code":4,"priority_name":"Baixa","product":"lsd0","category":"cat71","assigned_group":"Team09","total_incidents":1,"kpi_incidents":0,"kpi_violations":0,"avg_duration_seconds":21378284.0,"p95_duration_seconds":21378284},{"date":"2024-07-18","priority_code":3,"priority_name":"Média","product":"lsin","category":"cat24","assigned_group":"Team09","total_incidents":2,"kpi_incidents":2,"kpi_violations":2,"avg_duration_seconds":15657358.0,"p95_duration_seconds":15657526},{"date":"2024-07-18","priority_code":3,"priority_name":"Média","product":"lsin","category":"cat29","assigned_group":"Team09","total_incidents":1,"kpi_incidents":1,"kpi_violations":1,"avg_duration_seconds":15650552.0,"p95_duration_seconds":15650552},{"date":"2024-07-18","priority_code":4,"priority_name":"Baixa","product":"lemg","category":"cat85","assigned_group":"Team05","total_incidents":1,"kpi_incidents":0,"kpi_violations":0,"avg_duration_seconds":23148272.0,"p95_duration_seconds":23148272},{"date":"2024-07-19","priority_code":3,"priority_name":"Média","product":"lcem","category":"cat76","assigned_group":"Team05","total_incidents":1,"kpi_incidents":1,"kpi_violations":1,"avg_duration_seconds":35417289.0,"p95_duration_seconds":35417289},{"date":"2024-07-19","priority_code":3,"priority_name":"Média","product":"lsin","category":"cat24","assigned_group":"Team09","total_incidents":3,"kpi_incidents":3,"kpi_violations":3,"avg_duration_seconds":15568166.0,"p95_duration_seconds":15569098},{"date":"2024-07-19","priority_code":4,"priority_name":"Baixa","product":"lsin","category":"cat20","assigned_group":"Team02","total_incidents":1,"kpi_incidents":0,"kpi_violations":0,"avg_duration_seconds":26941762.0,"p95_duration_seconds":26941762},{"date":"2024-07-22","priority_code":3,"priority_name":"Média","product":"lcem","category":"cat76","assigned_group":"Team05","total_incidents":1,"kpi_incidents":1,"kpi_violations":1,"avg_duration_seconds":35159662.0,"p95_duration_seconds":35159662},{"date":"2024-07-22","priority_code":4,"priority_name":"Baixa","product":"lcem","category":"cat76","assigned_group":"Team05","total_incidents":1,"kpi_incidents":0,"kpi_violations":0,"avg_duration_seconds":22877045.0,"p95_duration_seconds":22877045},{"date":"2024-07-23","priority_code":3,"priority_name":"Média","product":"lcem","category":"cat91","assigned_group":"Team05","total_incidents":1,"kpi_incidents":1,"kpi_violations":1,"avg_duration_seconds":31086406.0,"p95_duration_seconds":31086406},{"date":"2024-07-23","priority_code":3,"priority_name":"Média","product":"lsin","category":"cat24","assigned_group":"Team09","total_incidents":1,"kpi_incidents":1,"kpi_violations":1,"avg_duration_seconds":15226879.0,"p95_duration_seconds":15226879},{"date":"2024-07-23","priority_code":3,"priority_name":"Média","product":"lsin","category":"cat39","assigned_group":"Team11","total_incidents":1,"kpi_incidents":1,"kpi_violations":1,"avg_duration_seconds":15145300.0,"p95_duration_seconds":15145300},{"date":"2024-07-25","priority_code":3,"priority_name":"Média","product":"lcem","category":"cat76","assigned_group":"Team05","total_incidents":1,"kpi_incidents":0,"kpi_violations":0,"avg_duration_seconds":30892885.0,"p95_duration_seconds":30892885},{"date":"2024-07-25","priority_code":3,"priority_name":"Média","product":"lcem","category":"cat91","assigned_group":"Team05","total_incidents":1,"kpi_incidents":1,"kpi_violations":1,"avg_duration_seconds":40513518.0,"p95_duration_seconds":40513518},{"date":"2024-07-25","priority_code":3,"priority_name":"Média","product":"lemg","category":"cat42","assigned_group":"Team05","total_incidents":1,"kpi_incidents":1,"kpi_violations":1,"avg_duration_seconds":34916756.0,"p95_duration_seconds":34916756},{"date":"2024-07-25","priority_code":3,"priority_name":"Média","product":"lemg","category":"cat85","assigned_group":"Team05","total_incidents":1,"kpi_incidents":1,"kpi_violations":1,"avg_duration_seconds":22519221.0,"p95_duration_seconds":22519221},{"date":"2024-07-25","priority_code":4,"priority_name":"Baixa","product":"lsin","category":"cat77","assigned_group":"Team09","total_incidents":1,"kpi_incidents":0,"kpi_violations":0,"avg_duration_seconds":20687483.0,"p95_duration_seconds":20687483},{"date":"2024-07-30","priority_code":3,"priority_name":"Média","product":"lcem","category":"cat91","assigned_group":"Team05","total_incidents":1,"kpi_incidents":1,"kpi_violations":1,"avg_duration_seconds":38746182.0,"p95_duration_seconds":38746182},{"date":"2024-07-31","priority_code":4,"priority_name":"Baixa","product":"lhco","category":"cat71","assigned_group":"Team09","total_incidents":1,"kpi_incidents":0,"kpi_violations":0,"avg_duration_seconds":20152744.0,"p95_duration_seconds":20152744},{"date":"2024-07-31","priority_code":4,"priority_name":"Baixa","product":"lsin","category":"cat121","assigned_group":"Team05","total_incidents":1,"kpi_incidents":0,"kpi_violations":0,"avg_duration_seconds":12992262.0,"p95_duration_seconds":12992262},{"date":"2024-07-31","priority_code":4,"priority_name":"Baixa","product":"lsin","category":"cat121","assigned_group":"Team09","total_incidents":1,"kpi_incidents":0,"kpi_violations":0,"avg_duration_seconds":21319576.0,"p95_duration_seconds":21319576}]}
