{"schema_version":"1.0","generated_at":"2026-08-12T11:27:12Z","mock":false,"records":[{"date":"2024-08-01","priority_code":3,"priority_name":"Média","product":"lsin","category":"cat24","assigned_group":"Team09","total_incidents":1,"kpi_incidents":1,"kpi_violations":1,"avg_duration_seconds":14426425.0,"p95_duration_seconds":14426425},{"date":"2024-08-04","priority_code":3,"priority_name":"Média","product":"lrel","category":"cat85","assigned_group":"Team05","total_incidents":1,"kpi_incidents":1,"kpi_violations":1,"avg_duration_seconds":19690988.0,"p95_duration_seconds":19690988},{"date":"2024-08-05","priority_code":3,"priority_name":"Média","product":"lcem","category":"cat91","assigned_group":"Team05","total_incidents":1,"kpi_incidents":1,"kpi_violations":1,"avg_duration_seconds":29938827.0,"p95_duration_seconds":29938827},{"date":"2024-08-05","priority_code":3,"priority_name":"Média","product":"lemn","category":"cat45","assigned_group":"Team09","total_incidents":1,"kpi_incidents":1,"kpi_violations":1,"avg_duration_seconds":14078851.0,"p95_duration_seconds":14078851},{"date":"2024-08-05","priority_code":3,"priority_name":"Média","product":"lsin","category":"cat24","assigned_group":"Team09","total_incidents":1,"kpi_incidents":1,"kpi_violations":1,"avg_duration_seconds":14047114.0,"p95_duration_seconds":14047114},{"date":"2024-08-06","priority_code":4,"priority_name":"Baixa","product":"lcem","category":"cat91","assigned_group":"Team05","total_incidents":1,"kpi_incidents":0,"kpi_violations":0,"avg_duration_seconds":19314487.0,"p95_duration_seconds":19314487},{"date":"2024-08-06","priority_code":4,"priority_name":"Baixa","product":"lsin","category":"cat77","assigned_group":"Team09","total_incidents":1,"kpi_incidents":0,"kpi_violations":0,"avg_duration_seconds":17428618.0,"p95_duration_seconds":17428618},{"date":"2024-08-07","priority_code":3,"priority_name":"Média","product":"lrel","category":"cat85","assigned_group":"Team09","total_incidents":1,"kpi_incidents":1,"kpi_violations":1,"avg_duration_seconds":13923560.0,"p95_duration_seconds":13923560},{"date":"2024-08-08","priority_code":4,"priority_name":"Baixa","product":"lhco","category":"cat71","assigned_group":"Team09","total_incidents":1,"kpi_incidents":0,"kpi_violations":0,"avg_duration_seconds":19482178.0,"p95_duration_seconds":19482178},{"date":"2024-08-09","priority_code":3,"priority_name":"Média","product":"lcem","category":"cat76","assigned_group":"Team05","total_incidents":1,"kpi_incidents":1,"kpi_violations":1,"avg_duration_seconds":12086725.0,"p95_duration_seconds":12086725},{"date":"2024-08-09","priority_code":3,"priority_name":"Média","product":"lhco","category":"cat71","assigned_group":"Team09","total_incidents":1,"kpi_incidents":1,"kpi_violations":1,"avg_duration_seconds":13739566.0,"p95_duration_seconds":13739566},{"date":"2024-08-11","priority_code":4,"priority_name":"Baixa","product":"lhco","category":"cat137","assigned_group":"Team17","total_incidents":1,"kpi_incidents":0,"kpi_violations":0,"avg_duration_seconds":12527769.0,"p95_duration_seconds":12527769},{"date":"2024-08-13","priority_code":3,"priority_name":"Média","product":"lcem","category":"cat76","assigned_group":"Team05","total_incidents":1,"kpi_incidents":1,"kpi_violations":1,"avg_duration_seconds":33240754.0,"p95_duration_seconds":33240754},{"date":"2024-08-13","priority_code":3,"priority_name":"Média","product":"lsin","category":"cat77","assigned_group":"Team14","total_incidents":1,"kpi_incidents":1,"kpi_violations":1,"avg_duration_seconds":34975997.0,"p95_duration_seconds":34975997},{"date":"2024-08-13","priority_code":4,"priority_name":"Baixa","product":"lhco","category":"cat71","assigned_group":"Team09","total_incidents":2,"kpi_incidents":0,"kpi_violations":0,"avg_duration_seconds":19008738.5,"p95_duration_seconds":19008993},{"date":"2024-08-14","priority_code":4,"priority_name":"Baixa","product":"lsin","category":"cat77","assigned_group":"Team09","total_incidents":1,"kpi_incidents":0,"kpi_violations":0,"avg_duration_seconds":16742127.0,"p95_duration_seconds":16742127},{"date":"2024-08-15","priority_code":4,"priority_name":"Baixa","product":"lhco","category":"cat71","assigned_group":"Team09","total_incidents":2,"kpi_incidents":0,"kpi_violations":0,"avg_duration_seconds":18873908.5,"p95_duration_seconds":18874079},{"date":"2024-08-15","priority_code":4,"priority_name":"Baixa","product":"lsin","category":"cat77","assigned_group":"Team09","total_incidents":1,"kpi_incidents":0,"kpi_violations":0,"avg_duration_seconds":18864955.0,"p95_duration_seconds":18864955},{"date":"2024-08-17","priority_code":4,"priority_name":"Baixa","product":"lsaa","category":"cat126","assigned_group":"Team05","total_incidents":1,"kpi_incidents":0,"kpi_violations":0,"avg_duration_seconds":11527720.0,"p95_duration_seconds":11527720},{"date":"2024-08-18","priority_code":4,"priority_name":"Baixa","product":"lsin","category":"cat77","assigned_group":"Team09","total_incidents":1,"kpi_incidents":0,"kpi_violations":0,"avg_duration_seconds":12959828.0,"p95_duration_seconds":12959828},{"date":"2024-08-20","priority_code":3,"priority_name":"Média","product":"lemg","category":"cat85","assigned_group":"Team05","total_incidents":1,"kpi_incidents":1,"kpi_violations":1,"avg_duration_seconds":20295104.0,"p95_duration_seconds":20295104},{"date":"2024-08-20","priority_code":4,"priority_name":"Baixa","product":"lcem","category":"cat91","assigned_group":"Team05","total_incidents":1,"kpi_incidents":0,"kpi_violations":0,"avg_duration_seconds":28660885.0,"p95_duration_seconds":28660885},{"date":"2024-08-21","priority_code":3,"priority_name":"Média","product":"lcem","category":"cat76","assigned_group":"Team05","total_incidents":1,"kpi_incidents":1,"kpi_violations":1,"avg_duration_seconds":32578615.0,"p95_duration_seconds":32578615},{"date":"2024-08-21","priority_code":3,"priority_name":"Média","product":"lcem","category":"cat91","assigned_group":"Team05","total_incidents":1,"kpi_incidents":1,"kpi_violations":1,"avg_duration_seconds":15623599.0,"p95_duration_seconds":15623599},{"date":"2024-08-21","priority_code":3,"priority_name":"Média","product":"lemg","category":"cat85","assigned_group":"Team05","total_incidents":1,"kpi_incidents":1,"kpi_violations":1,"avg_duration_seconds":12903913.0,"p95_duration_seconds":12903913},{"date":"2024-08-21","priority_code":3,"priority_name":"Média","product":"lsin","category":"cat24","assigned_group":"Team09","total_incidents":1,"kpi_incidents":1,"kpi_violations":1,"avg_duration_seconds":12698546.0,"p95_duration_seconds":12698546},{"date":"2024-08-22","priority_code":3,"priority_name":"Média","product":"lcem","category":"cat76","assigned_group":"Team05","total_incidents":1,"kpi_incidents":1,"kpi_violations":1,"avg_duration_seconds":38089310.0,"p95_duration_seconds":38089310},{"date":"2024-08-22","priority_code":4,"priority_name":"Baixa","product":"lsg2","category":"cat71","assigned_group":"Team09","total_incidents":1,"kpi_incidents":0,"kpi_violations":0,"avg_duration_seconds":18222844.0,"p95_duration_seconds":18222844},{"date":"2024-08-23","priority_code":3,"priority_name":"Média","product":"lcem","category":"cat76","assigned_group":"Team05","total_incidents":1,"kpi_incidents":1,"kpi_violations":1,"avg_duration_seconds":17194614.0,"p95_duration_seconds":17194614},{"date":"2024-08-26","priority_code":3,"priority_name":"Média","product":"lcem","category":"cat76","assigned_group":"Team05","total_incidents":2,"kpi_incidents":2,"kpi_violations":2,"avg_duration_seconds":34935644.0,"p95_duration_seconds":37745718},{"date":"2024-08-27","priority_code":3,"priority_name":"Média","product":"lsin","category":"cat68","assigned_group":"Team05","total_incidents":1,"kpi_incidents":1,"kpi_violations":1,"avg_duration_seconds":37649648.0,"p95_duration_seconds":37649648},{"date":"2024-08-28","priority_code":4,"priority_name":"Baixa","product":"lcem","category":"cat76","assigned_group":"Team05","total_incidents":2,"kpi_incidents":0,"kpi_violations":0,"avg_duration_seconds":10631042.5,"p95_duration_seconds":10631450},{"date":"2024-08-30","priority_code":3,"priority_name":"Média","product":"lcem","category":"cat76","assigned_group":"Team05","total_incidents":1,"kpi_incidents":1,"kpi_violations":1,"avg_duration_seconds":37395619.0,"p95_duration_seconds":37395619},{"date":"2024-08-30","priority_code":3,"priority_name":"Média","product":"lcem","category":"cat91","assigned_group":"Team05","total_incidents":1,"kpi_incidents":1,"kpi_violations":1,"avg_duration_seconds":19405820.0,"p95_duration_seconds":19405820},{"date":"2024-08-30","priority_code":3,"priority_name":"Média","product":"lsin","category":"cat29","assigned_group":"Team09","total_incidents":1,"kpi_incidents":1,"kpi_violations":1,"avg_duration_seconds":11923425.0,"p95_duration_seconds":11923425}]}
