{"schema_version":"1.0","generated_at":"2026-08-12T11:27:12Z","mock":false,"records":[{"date":"2024-03-02","priority_code":3,"priority_name":"Média","product":"lcem","category":"cat76","assigned_group":"Team05","total_incidents":1,"kpi_incidents":1,"kpi_violations":1,"avg_duration_seconds":33779715.0,"p95_duration_seconds":33779715},{"date":"2024-03-02","priority_code":3,"priority_name":"Média","product":"lcem","category":"cat91","assigned_group":"Team05","total_incidents":1,"kpi_incidents":1,"kpi_violations":1,"avg_duration_seconds":35063610.0,"p95_duration_seconds":35063610},{"date":"2024-03-03","priority_code":4,"priority_name":"Baixa","product":"lcem","category":"cat59","assigned_group":"Team05","total_incidents":1,"kpi_incidents":0,"kpi_violations":0,"avg_duration_seconds":52048609.0,"p95_duration_seconds":52048609},{"date":"2024-03-04","priority_code":3,"priority_name":"Média","product":"lsin","category":"cat24","assigned_group":"Team09","total_incidents":1,"kpi_incidents":1,"kpi_violations":1,"avg_duration_seconds":27385577.0,"p95_duration_seconds":27385577},{"date":"2024-03-05","priority_code":3,"priority_name":"Média","product":"lcem","category":"cat59","assigned_group":"Team05","total_incidents":1,"kpi_incidents":1,"kpi_violations":1,"avg_duration_seconds":51920819.0,"p95_duration_seconds":51920819},{"date":"2024-03-05","priority_code":4,"priority_name":"Baixa","product":"lcem","category":"cat76","assigned_group":"Team05","total_incidents":2,"kpi_incidents":0,"kpi_violations":0,"avg_duration_seconds":25754837.5,"p95_duration_seconds":25755525},{"date":"2024-03-06","priority_code":3,"priority_name":"Média","product":"lcem","category":"cat59","assigned_group":"Team05","total_incidents":1,"kpi_incidents":1,"kpi_violations":1,"avg_duration_seconds":51845482.0,"p95_duration_seconds":51845482},{"date":"2024-03-07","priority_code":3,"priority_name":"Média","product":"lcem","category":"cat76","assigned_group":"Team06","total_incidents":1,"kpi_incidents":1,"kpi_violations":1,"avg_duration_seconds":34714763.0,"p95_duration_seconds":34714763},{"date":"2024-03-08","priority_code":3,"priority_name":"Média","product":null,"category":"cat59","assigned_group":"Team05","total_incidents":1,"kpi_incidents":1,"kpi_violations":1,"avg_duration_seconds":51627665.0,"p95_duration_seconds":51627665},{"date":"2024-03-09","priority_code":3,"priority_name":"Média","product":"lsaa","category":"cat126","assigned_group":"Team06","total_incidents":1,"kpi_incidents":1,"kpi_violations":1,"avg_duration_seconds":34571492.0,"p95_duration_seconds":34571492},{"date":"2024-03-10","priority_code":3,"priority_name":"Média","product":"lcem","category":"cat76","assigned_group":"Team05","total_incidents":1,"kpi_incidents":1,"kpi_violations":1,"avg_duration_seconds":51007062.0,"p95_duration_seconds":51007062},{"date":"2024-03-11","priority_code":3,"priority_name":"Média","product":"lcem","category":"cat59","assigned_group":"Team05","total_incidents":1,"kpi_incidents":1,"kpi_violations":1,"avg_duration_seconds":51398940.0,"p95_duration_seconds":51398940},{"date":"2024-03-12","priority_code":3,"priority_name":"Média","product":"lcsp","category":"cat85","assigned_group":"Team14","total_incidents":1,"kpi_incidents":1,"kpi_violations":1,"avg_duration_seconds":33830095.0,"p95_duration_seconds":33830095},{"date":"2024-03-12","priority_code":3,"priority_name":"Média","product":"lemg","category":"cat85","assigned_group":"Team05","total_incidents":1,"kpi_incidents":1,"kpi_violations":1,"avg_duration_seconds":34169679.0,"p95_duration_seconds":34169679},{"date":"2024-03-13","priority_code":3,"priority_name":"Média","product":"lcsi","category":"cat41","assigned_group":"Team14","total_incidents":1,"kpi_incidents":1,"kpi_violations":1,"avg_duration_seconds":50273269.0,"p95_duration_seconds":50273269},{"date":"2024-03-15","priority_code":3,"priority_name":"Média","product":null,"category":"cat59","assigned_group":"Team05","total_incidents":2,"kpi_incidents":2,"kpi_violations":2,"avg_duration_seconds":51022799.5,"p95_duration_seconds":51027590},{"date":"2024-03-18","priority_code":4,"priority_name":"Baixa","product":"lcem","category":"cat48","assigned_group":"Team05","total_incidents":1,"kpi_incidents":0,"kpi_violations":0,"avg_duration_seconds":24704196.0,"p95_duration_seconds":24704196},{"date":"2024-03-19","priority_code":3,"priority_name":"Média","product":"lcem","category":"cat76","assigned_group":"Team06","total_incidents":1,"kpi_incidents":1,"kpi_violations":1,"avg_duration_seconds":45985837.0,"p95_duration_seconds":45985837},{"date":"2024-03-19","priority_code":3,"priority_name":"Média","product":"lvps","category":"cat85","assigned_group":"Team14","total_incidents":1,"kpi_incidents":1,"kpi_violations":1,"avg_duration_seconds":33228290.0,"p95_duration_seconds":33228290},{"date":"2024-03-19","priority_code":4,"priority_name":"Baixa","product":"lsin","category":"cat115","assigned_group":"Team12","total_incidents":1,"kpi_incidents":0,"kpi_violations":0,"avg_duration_seconds":25883243.0,"p95_duration_seconds":25883243},{"date":"2024-03-19","priority_code":4,"priority_name":"Baixa","product":"lsin","category":"cat77","assigned_group":"Team12","total_incidents":2,"kpi_incidents":0,"kpi_violations":0,"avg_duration_seconds":25883855.5,"p95_duration_seconds":25884444},{"date":"2024-03-22","priority_code":3,"priority_name":"Média","product":"lcem","category":"cat76","assigned_group":"Team05","total_incidents":1,"kpi_incidents":1,"kpi_violations":1,"avg_duration_seconds":33401559.0,"p95_duration_seconds":33401559},{"date":"2024-03-22","priority_code":3,"priority_name":"Média","product":"lcem","category":"cat76","assigned_group":"Team06","total_incidents":1,"kpi_incidents":1,"kpi_violations":1,"avg_duration_seconds":33416927.0,"p95_duration_seconds":33416927},{"date":"2024-03-22","priority_code":3,"priority_name":"Média","product":"lsin","category":"cat68","assigned_group":"Team05","total_incidents":1,"kpi_incidents":1,"kpi_violations":1,"avg_duration_seconds":27793899.0,"p95_duration_seconds":27793899},{"date":"2024-03-23","priority_code":3,"priority_name":"Média","product":"lcem","category":"cat76","assigned_group":"Team05","total_incidents":1,"kpi_incidents":1,"kpi_violations":1,"avg_duration_seconds":45622452.0,"p95_duration_seconds":45622452},{"date":"2024-03-26","priority_code":4,"priority_name":"Baixa","product":"lsin","category":"cat77","assigned_group":"Team09","total_incidents":4,"kpi_incidents":0,"kpi_violations":0,"avg_duration_seconds":25481558.75,"p95_duration_seconds":25482543}]}
