{"schema_version":"1.0","generated_at":"2026-08-12T11:27:12Z","mock":false,"records":[{"date":"2023-05-05","priority_code":3,"priority_name":"Média","product":"lcem","category":"cat76","assigned_group":"Team06","total_incidents":1,"kpi_incidents":1,"kpi_violations":1,"avg_duration_seconds":58311110.0,"p95_duration_seconds":58311110},{"date":"2023-05-06","priority_code":3,"priority_name":"Média","product":"lcem","category":"cat76","assigned_group":"Team05","total_incidents":1,"kpi_incidents":1,"kpi_violations":1,"avg_duration_seconds":77699572.0,"p95_duration_seconds":77699572},{"date":"2023-05-10","priority_code":5,"priority_name":"Muito Baixa","product":"lsin","category":"cat131","assigned_group":"Team09","total_incidents":1,"kpi_incidents":0,"kpi_violations":0,"avg_duration_seconds":60485906.0,"p95_duration_seconds":60485906},{"date":"2023-05-20","priority_code":4,"priority_name":"Baixa","product":"lhvp","category":"cat138","assigned_group":"Team17","total_incidents":1,"kpi_incidents":0,"kpi_violations":0,"avg_duration_seconds":51320524.0,"p95_duration_seconds":51320524},{"date":"2023-05-23","priority_code":3,"priority_name":"Média","product":"lcem","category":"cat76","assigned_group":"Team06","total_incidents":1,"kpi_incidents":1,"kpi_violations":1,"avg_duration_seconds":56747118.0,"p95_duration_seconds":56747118},{"date":"2023-05-25","priority_code":3,"priority_name":"Média","product":"lcem","category":"cat76","assigned_group":"Team06","total_incidents":1,"kpi_incidents":1,"kpi_violations":1,"avg_duration_seconds":56570316.0,"p95_duration_seconds":56570316},{"date":"2023-05-30","priority_code":3,"priority_name":"Média","product":"lcem","category":"cat76","assigned_group":"Team06","total_incidents":1,"kpi_incidents":1,"kpi_violations":1,"avg_duration_seconds":56149922.0,"p95_duration_seconds":56149922}]}
