{"schema_version":"1.0","generated_at":"2026-08-12T11:27:12Z","mock":false,"records":[{"date":"2024-02-01","priority_code":3,"priority_name":"Média","product":"lsaa","category":"cat43","assigned_group":"Team05","total_incidents":3,"kpi_incidents":3,"kpi_violations":3,"avg_duration_seconds":35453930.33,"p95_duration_seconds":35454385},{"date":"2024-02-16","priority_code":3,"priority_name":"Média","product":"lcem","category":"cat91","assigned_group":"Team11","total_incidents":1,"kpi_incidents":1,"kpi_violations":1,"avg_duration_seconds":35827038.0,"p95_duration_seconds":35827038},{"date":"2024-02-20","priority_code":3,"priority_name":"Média","product":"lbho","category":"cat104","assigned_group":"Team11","total_incidents":1,"kpi_incidents":1,"kpi_violations":1,"avg_duration_seconds":53642412.0,"p95_duration_seconds":53642412},{"date":"2024-02-20","priority_code":4,"priority_name":"Baixa","product":"lhco","category":"cat71","assigned_group":"Team09","total_incidents":1,"kpi_incidents":0,"kpi_violations":0,"avg_duration_seconds":40588635.0,"p95_duration_seconds":40588635},{"date":"2024-02-21","priority_code":3,"priority_name":"Média","product":"lbho","category":"cat86","assigned_group":"Team09","total_incidents":1,"kpi_incidents":1,"kpi_violations":1,"avg_duration_seconds":28437490.0,"p95_duration_seconds":28437490},{"date":"2024-02-22","priority_code":4,"priority_name":"Baixa","product":"lhco","category":"cat71","assigned_group":"Team09","total_incidents":1,"kpi_incidents":0,"kpi_violations":0,"avg_duration_seconds":33978662.0,"p95_duration_seconds":33978662},{"date":"2024-02-24","priority_code":3,"priority_name":"Média","product":"lcem","category":"cat91","assigned_group":"Team05","total_incidents":1,"kpi_incidents":1,"kpi_violations":1,"avg_duration_seconds":52313054.0,"p95_duration_seconds":52313054},{"date":"2024-02-27","priority_code":3,"priority_name":"Média","product":"lsaa","category":"cat126","assigned_group":"Team05","total_incidents":1,"kpi_incidents":1,"kpi_violations":1,"avg_duration_seconds":28133617.0,"p95_duration_seconds":28133617},{"date":"2024-02-27","priority_code":4,"priority_name":"Baixa","product":"lsmt","category":"cat46","assigned_group":"Team05","total_incidents":1,"kpi_incidents":0,"kpi_violations":0,"avg_duration_seconds":28136769.0,"p95_duration_seconds":28136769},{"date":"2024-02-28","priority_code":3,"priority_name":"Média","product":"lexc","category":"cat88","assigned_group":"Team11","total_incidents":1,"kpi_incidents":1,"kpi_violations":1,"avg_duration_seconds":34800688.0,"p95_duration_seconds":34800688}]}
