{"schema_version":"1.0","generated_at":"2026-08-12T11:27:12Z","mock":false,"records":[{"date":"2023-12-04","priority_code":3,"priority_name":"Média","product":"lemg","category":"cat85","assigned_group":"Team05","total_incidents":1,"kpi_incidents":1,"kpi_violations":1,"avg_duration_seconds":42733326.0,"p95_duration_seconds":42733326},{"date":"2023-12-05","priority_code":3,"priority_name":"Média","product":"lemg","category":"cat85","assigned_group":"Team05","total_incidents":1,"kpi_incidents":1,"kpi_violations":1,"avg_duration_seconds":42682758.0,"p95_duration_seconds":42682758},{"date":"2023-12-05","priority_code":4,"priority_name":"Baixa","product":"lcem","category":"cat76","assigned_group":"Team05","total_incidents":1,"kpi_incidents":0,"kpi_violations":0,"avg_duration_seconds":33634577.0,"p95_duration_seconds":33634577},{"date":"2023-12-12","priority_code":4,"priority_name":"Baixa","product":"lsin","category":"cat131","assigned_group":"Team09","total_incidents":1,"kpi_incidents":0,"kpi_violations":0,"avg_duration_seconds":40199871.0,"p95_duration_seconds":40199871},{"date":"2023-12-14","priority_code":3,"priority_name":"Média","product":"lemg","category":"cat85","assigned_group":"Team05","total_incidents":1,"kpi_incidents":1,"kpi_violations":1,"avg_duration_seconds":41901312.0,"p95_duration_seconds":41901312},{"date":"2023-12-27","priority_code":4,"priority_name":"Baixa","product":"lsin","category":"cat20","assigned_group":"Team02","total_incidents":1,"kpi_incidents":0,"kpi_violations":0,"avg_duration_seconds":62222525.0,"p95_duration_seconds":62222525},{"date":"2023-12-28","priority_code":4,"priority_name":"Baixa","product":"lsd0","category":"cat71","assigned_group":"Team09","total_incidents":1,"kpi_incidents":0,"kpi_violations":0,"avg_duration_seconds":40536851.0,"p95_duration_seconds":40536851},{"date":"2023-12-30","priority_code":3,"priority_name":"Média","product":"lhco","category":"cat71","assigned_group":"Team09","total_incidents":1,"kpi_incidents":1,"kpi_violations":1,"avg_duration_seconds":32989473.0,"p95_duration_seconds":32989473}]}
