{"schema_version":"1.0","generated_at":"2026-08-12T11:27:12Z","mock":false,"records":[{"date":"2023-02-02","priority_code":3,"priority_name":"Média","product":"lcem","category":"cat91","assigned_group":"Team05","total_incidents":1,"kpi_incidents":1,"kpi_violations":1,"avg_duration_seconds":85724195.0,"p95_duration_seconds":85724195},{"date":"2023-02-05","priority_code":3,"priority_name":"Média","product":"lcsi","category":"cat38","assigned_group":"Team11","total_incidents":1,"kpi_incidents":1,"kpi_violations":1,"avg_duration_seconds":64172396.0,"p95_duration_seconds":64172396},{"date":"2023-02-06","priority_code":3,"priority_name":"Média","product":"lcem","category":"cat31","assigned_group":"Team11","total_incidents":1,"kpi_incidents":1,"kpi_violations":1,"avg_duration_seconds":76288655.0,"p95_duration_seconds":76288655},{"date":"2023-02-08","priority_code":3,"priority_name":"Média","product":"lcem","category":"cat76","assigned_group":"Team06","total_incidents":1,"kpi_incidents":1,"kpi_violations":1,"avg_duration_seconds":65720231.0,"p95_duration_seconds":65720231},{"date":"2023-02-09","priority_code":3,"priority_name":"Média","product":"lsin","category":"cat29","assigned_group":"Team09","total_incidents":1,"kpi_incidents":1,"kpi_violations":1,"avg_duration_seconds":61003865.0,"p95_duration_seconds":61003865},{"date":"2023-02-14","priority_code":3,"priority_name":"Média","product":"lcem","category":"cat91","assigned_group":"Team05","total_incidents":1,"kpi_incidents":1,"kpi_violations":1,"avg_duration_seconds":84684454.0,"p95_duration_seconds":84684454},{"date":"2023-02-27","priority_code":3,"priority_name":"Média","product":"lemn","category":"cat103","assigned_group":"Team11","total_incidents":1,"kpi_incidents":1,"kpi_violations":1,"avg_duration_seconds":66419428.0,"p95_duration_seconds":66419428}]}
