{"schema_version":"1.0","generated_at":"2026-08-12T11:27:12Z","mock":false,"records":[{"date":"2024-09-03","priority_code":3,"priority_name":"Média","product":"lcsp","category":"cat85","assigned_group":"Team14","total_incidents":1,"kpi_incidents":1,"kpi_violations":1,"avg_duration_seconds":35680158.0,"p95_duration_seconds":35680158},{"date":"2024-09-03","priority_code":3,"priority_name":"Média","product":"lemg","category":"cat85","assigned_group":"Team05","total_incidents":1,"kpi_incidents":1,"kpi_violations":1,"avg_duration_seconds":19068570.0,"p95_duration_seconds":19068570},{"date":"2024-09-04","priority_code":3,"priority_name":"Média","product":"lemg","category":"cat85","assigned_group":"Team05","total_incidents":1,"kpi_incidents":1,"kpi_violations":1,"avg_duration_seconds":18998000.0,"p95_duration_seconds":18998000},{"date":"2024-09-04","priority_code":4,"priority_name":"Baixa","product":"lsin","category":"cat77","assigned_group":"Team09","total_incidents":1,"kpi_incidents":0,"kpi_violations":0,"avg_duration_seconds":11484763.0,"p95_duration_seconds":11484763},{"date":"2024-09-06","priority_code":4,"priority_name":"Baixa","product":"lsin","category":"cat77","assigned_group":"Team09","total_incidents":2,"kpi_incidents":0,"kpi_violations":0,"avg_duration_seconds":11317669.5,"p95_duration_seconds":11317833},{"date":"2024-09-09","priority_code":4,"priority_name":"Baixa","product":"lcem","category":"cat76","assigned_group":"Team05","total_incidents":2,"kpi_incidents":0,"kpi_violations":0,"avg_duration_seconds":9539220.0,"p95_duration_seconds":9539235},{"date":"2024-09-10","priority_code":3,"priority_name":"Média","product":"lsin","category":"cat24","assigned_group":"Team05","total_incidents":1,"kpi_incidents":1,"kpi_violations":1,"avg_duration_seconds":34014853.0,"p95_duration_seconds":34014853},{"date":"2024-09-11","priority_code":3,"priority_name":"Média","product":"lcem","category":"cat76","assigned_group":"Team05","total_incidents":1,"kpi_incidents":1,"kpi_violations":1,"avg_duration_seconds":30755952.0,"p95_duration_seconds":30755952},{"date":"2024-09-11","priority_code":3,"priority_name":"Média","product":"lsaa","category":"cat126","assigned_group":"Team05","total_incidents":1,"kpi_incidents":1,"kpi_violations":1,"avg_duration_seconds":16188676.0,"p95_duration_seconds":16188676},{"date":"2024-09-18","priority_code":3,"priority_name":"Média","product":"lcem","category":"cat91","assigned_group":"Team11","total_incidents":1,"kpi_incidents":1,"kpi_violations":1,"avg_duration_seconds":25286030.0,"p95_duration_seconds":25286030},{"date":"2024-09-18","priority_code":4,"priority_name":"Baixa","product":"lrel","category":"cat85","assigned_group":"Team09","total_incidents":1,"kpi_incidents":0,"kpi_violations":0,"avg_duration_seconds":33095104.0,"p95_duration_seconds":33095104},{"date":"2024-09-19","priority_code":3,"priority_name":"Média","product":"lcem","category":"cat76","assigned_group":"Team05","total_incidents":3,"kpi_incidents":3,"kpi_violations":3,"avg_duration_seconds":33356733.0,"p95_duration_seconds":35688927},{"date":"2024-09-20","priority_code":3,"priority_name":"Média","product":"lcem","category":"cat76","assigned_group":"Team05","total_incidents":1,"kpi_incidents":1,"kpi_violations":1,"avg_duration_seconds":10094736.0,"p95_duration_seconds":10094736},{"date":"2024-09-23","priority_code":3,"priority_name":"Média","product":"lcem","category":"cat76","assigned_group":"Team05","total_incidents":1,"kpi_incidents":1,"kpi_violations":1,"avg_duration_seconds":35320422.0,"p95_duration_seconds":35320422},{"date":"2024-09-24","priority_code":3,"priority_name":"Média","product":"lexc","category":"cat48","assigned_group":"Team07","total_incidents":1,"kpi_incidents":1,"kpi_violations":1,"avg_duration_seconds":38792858.0,"p95_duration_seconds":38792858},{"date":"2024-09-24","priority_code":3,"priority_name":"Média","product":"lrev","category":"cat94","assigned_group":"Team05","total_incidents":1,"kpi_incidents":1,"kpi_violations":1,"avg_duration_seconds":37064689.0,"p95_duration_seconds":37064689},{"date":"2024-09-24","priority_code":4,"priority_name":"Baixa","product":"lcem","category":"cat76","assigned_group":"Team05","total_incidents":1,"kpi_incidents":0,"kpi_violations":0,"avg_duration_seconds":8230698.0,"p95_duration_seconds":8230698},{"date":"2024-09-25","priority_code":3,"priority_name":"Média","product":"lcem","category":"cat76","assigned_group":"Team05","total_incidents":3,"kpi_incidents":3,"kpi_violations":3,"avg_duration_seconds":18032885.33,"p95_duration_seconds":29536030},{"date":"2024-09-25","priority_code":3,"priority_name":"Média","product":"lcem","category":"cat91","assigned_group":"Team11","total_incidents":1,"kpi_incidents":1,"kpi_violations":1,"avg_duration_seconds":24710630.0,"p95_duration_seconds":24710630},{"date":"2024-09-26","priority_code":3,"priority_name":"Média","product":"lcem","category":"cat76","assigned_group":"Team05","total_incidents":1,"kpi_incidents":1,"kpi_violations":1,"avg_duration_seconds":12254516.0,"p95_duration_seconds":12254516},{"date":"2024-09-26","priority_code":4,"priority_name":"Baixa","product":"lcem","category":"cat76","assigned_group":"Team05","total_incidents":1,"kpi_incidents":0,"kpi_violations":0,"avg_duration_seconds":8093712.0,"p95_duration_seconds":8093712},{"date":"2024-09-28","priority_code":3,"priority_name":"Média","product":"lcem","category":"cat76","assigned_group":"Team05","total_incidents":1,"kpi_incidents":1,"kpi_violations":1,"avg_duration_seconds":14089469.0,"p95_duration_seconds":14089469},{"date":"2024-09-28","priority_code":3,"priority_name":"Média","product":"lcem","category":"cat91","assigned_group":"Team05","total_incidents":1,"kpi_incidents":1,"kpi_violations":1,"avg_duration_seconds":12346954.0,"p95_duration_seconds":12346954},{"date":"2024-09-29","priority_code":4,"priority_name":"Baixa","product":"lhco","category":"cat71","assigned_group":"Team09","total_incidents":3,"kpi_incidents":0,"kpi_violations":0,"avg_duration_seconds":15755698.33,"p95_duration_seconds":16147980},{"date":"2024-09-29","priority_code":4,"priority_name":"Baixa","product":"lsin","category":"cat28","assigned_group":"Team09","total_incidents":1,"kpi_incidents":0,"kpi_violations":0,"avg_duration_seconds":16158349.0,"p95_duration_seconds":16158349},{"date":"2024-09-30","priority_code":3,"priority_name":"Média","product":"lhco","category":"cat85","assigned_group":"Team11","total_incidents":1,"kpi_incidents":1,"kpi_violations":1,"avg_duration_seconds":24248571.0,"p95_duration_seconds":24248571}]}
